章番号,問題番号,分類名称,問題文,選択肢１,選択肢２,選択肢３,選択肢４,選択肢５,解答番号,解答,解説,
SECT001,Q0470,オプションと原資産,原資産としての株式、行使価格、満期が同じヨーロピアン・タイプのコールオプションとプットオプションを考える。 いま、１単位のコール買い、１単位のプット売りを行った。このポジションに加えて、次の取引のどれを行えば、原資産である 株式を１単位保有しているのと同じになりますか。ただし、rはオプションの満期までの間のリスクフリー・レート（年率換算せず） を示す。株式に配当の支払いはない。,オプションと満期が等しい割引債を、行使価格と同じ額面分だけ購入する。,オプションと満期が等しい割引債を、行使価格と同じ額面分だけ空売りする。,オプションと満期が等しい割引債を、行使価格/1+r　と同じ額面分だけ購入する。,オプションと満期が等しい割引債を、行使価格/1+r と同じ額面分だけ空売りする。,【５】-,1,オプションと満期が等しい割引債を、行使価格と同じ額面分だけ購入する。,プット・コールパリティ・・・コールの価格－プットの価格＋行使価格/1+r　＝　原資産価格#権利行使価格1000円の株式を例に、コールオプションの買いとプットオプションの 売りを足すと原資産価格が0円の場合に-1000円となる右肩上がりの直線となる。#これに満期時に1000円（行使価格）となる割引債を足すことで原資産と満期価値が一致する直線となるため、 原資産価格と一致する。満期時に行使価格となるような割引債の現在価値は行使価格/1+rである。#※ただし、rはオプション満期までの間の無リスク金利（年率換算せず）である。,
SECT001,Q0480,リスク中立確率,株価が次のように変化するとき、株価上昇のリスク中立確率はいくらですか。ただし、この株式は配当を支払わず、年率のリスクフリー・レート は１％とする。,0.25円,0.30円,0.40円,0.55円,【５】-,3,0.40円,まずはリスク中立確率pを求める。原資産価格の算出式から、100=(110×p+(1-p)×95)/1+0.01#これをといて、p=0.4#よって正解は3となる。,
SECT001,Q0490,オプションによる投資戦略,オプションを用いた以下の投資戦略のうち、原資産の価格が高くなればなるほど満期時点の利益が大きくなるものはどれですか。ただし、用いるオプションの 原資産および限月は同一のものとする。,バーティカル・ブル・プット・スプレッド,プロテクティブ・プット,カバード・コール・ライト,ストライドの売り,【５】-,3,カバード・コール・ライト,プロテクティブ・プットとは原資産買い＋プットOP買いのことで、原資産価格上昇時の利益を一部放棄し、原資産価格下落時の損失を限定させる。#また、カバード・コール・ライトは原資産買い＋コールOP売りのことで、原資産価格上昇時の利益を限定するかわりに、原資産価格下落時に、原資産だけを保有していた場合に比べ、OP料分損益が上昇する,
SECT001,Q0500,確率分布,確率分布に関する次の記述のうち、正しくないものはどれですか。,正規分布は、平均と分散という２つの数値を与えれば分布の形が確定する。,リターンが正規分布に従う２銘柄を組み合わせたポートフォリオのリターンは、必ずしも正規分布に従うとは限らない。,正規分布の歪度はゼロである。,標準正規分布の分散は１である。,【５】-,2,リターンが正規分布に従う２銘柄を組み合わせたポートフォリオのリターンは、必ずしも正規分布に従うとは限らない。,複数の正規分布の線形結合は、正規分布になる。,
SECT001,Q0510,リターンデータを用いたマーケットモデル,過去のリターン・データを用いたマーケットモデルの推定に関する次の記述のうち、、正しくないものはどれですか。,リターンは、安全資産のリターンを差し引いた超過リターンを使用する。,ヒストリカルベータの推定では、過去24ヵ月の月次リターンを用いることとされている。,説明変数と被説明変数の相関係数の符号は、回帰線の傾きの正負によって判断できる。,t検定を行うには、残差項の分布に特定の仮定を置くことが必要である。,【５】-,2,ヒストリカルベータの推定では、過去24ヵ月の月次リターンを用いることとされている。,ヒストリカルベータは過去一定期間の投資収益率を市場全体の収益率と回帰分析することで求めたファンド及び、 個別銘柄のベータでこの際に用いる過去データは24カ月と決まっているわけではない。#t検定とは、２つの集合を比較した際にその２つの集合に有意差（意味のある差）があるかどうかを検定する方法。#t値が大きい程、意味のある差である可能性が高くなり、t値から計算するp値の値が5%または1%の値以下になると意味のある差であると言える。,
SECT001,Q0520,リスク回避的な投資家選好,リスク回避的な投資家選好に関する次の記述のうち、、正しくないものはどれですか。,曲率の小さい効用関数を持つ投資家は、曲率の大きい効用関数を持つ投資家よりもリスク回避的である。,効用の数値の大小では個人間の効用の大きさを比較できない。,リスク回避度は、効用の単位の正の一次変換によって左右されない。,価値が確率的に変動するリスク資産の確実性等価額は、その資産の期待値よりも小さい。,【５】-,1,曲率の小さい効用関数を持つ投資家は、曲率の大きい効用関数を持つ投資家よりもリスク回避的である。,曲率の大きい効用関数を持つ投資家の方が、曲率の小さい効用関数を持つ投資家よりリスク回避的である。効用図が直線だとリスク中立的に近づく。,
SECT001,Q0530,CAPM,CAPMに関する次の記述のうち、、正しくないものはどれですか。,CAPMにおいては、市場は分散投資によって削減できるリスクに対して対価を要求しない。,ポートフォリオのベータは、ポートフォリオに組み入れられる各証券のベータを、銘柄別の投資比率で加重平均した値になる。,ベータが負の証券があれば、それに市場が要求する期待リターンはリスクフリーレートよりも小さくなる。,貸出利子率と貸入利子率が異なるゼロベータCAPMでは、市場の均衡状態においてマーケットポートフォリオは効率的ポートフォリオでなくなる。,【５】-,4,貸出利子率と貸入利子率が異なるゼロベータCAPMでは、市場の均衡状態においてマーケットポートフォリオは効率的ポートフォリオでなくなる。,ゼロベータCAPMでも市場の均衡状態においてマーケットポートフォリオは効率的なポートフォリオである。,
SECT001,Q0540,マルチファクター・モデルとAPT,マルチファクター・モデルとAPTに関する次の記述のうち、、正しいものはどれですか。,マルチファクター・モデルでは、証券のリスクを複数のファクターに対するエクスポージャーによってとらえる。,マルチファクター・モデルは、トラッキングエラーの管理には用いられない。,APTでは一般に、リスクフリー・レートの水準も含めてファクタープレミアムで説明される。,ファクターは多くの証券にリスクを与えるものなので、APTによればファクタープレミアムは正となる。,【５】-,1,マルチファクター・モデルでは、証券のリスクを複数のファクターに対するエクスポージャーによってとらえる。,APT(Arbitrage Priceing Theory：裁定価格理論)・・・ノー・フリーランチの原理、「世の中にただメシはない」という理屈から導かれた 理論であり、需要と供給の原理を用いてリスクの価格を求めたCAPMとは異なる理論。#マルチファクターモデル・・・株式の収益率を複数の要因（ファクター）から説明するモデル。代表的なモデルとしては、ファーマ＝フレンチ の３ファクターモデル（マーケットファクター、企業規模ファクター、バリューファクター）等がある。これに比べ、CAPMはマーケットファクターのみを 考慮しているのでシングルファクターモデルといえる。 ,
SECT001,Q0550,ポートフォリオリスク,次のうち正しいものを選んでください。,２証券のポートフォリオにおけるリスクはそれらの証券の共分散の平方根である。,ポートフォリオのリスクとは期待収益率の過去の時系列平均である。,ポートフォリオのリスクとは期待収益率の過去の時系列平均の標準偏差ではない。,AとBの証券の共分散はA証券の標準偏差xB証券標準偏差である,【５】-,1,２証券のポートフォリオにおけるリスクはそれらの証券の共分散の平方根である。,ポートフォリオのリスクとはポートフォリオの期待収益率の過去の時系列平均に対する(ベンチマーク収益率との差額の）標準偏差と捉えることもできる。#4についてはAとBの証券の共分散は[これらの証券の相関係数]x[A証券の標準偏差]x[B証券標準偏差]である,
[EOF],,,,,,,,,,,,