章番号,問題番号,分類名称,問題文,選択肢１,選択肢２,選択肢３,選択肢４,選択肢５,解答番号,解答,解説,
SECT001,Q0240,配当割引モデルによる理論価格,2012年度末時点で、X社は2013年度と2014年度に無配とするが、2015年度末に1株当たり5円の配当を行い、その後は毎年5％ずつ増配していく予定である。 X社に対する株主の要求収益率が10％で一定とすると、現時点（2012年度末）で配当割引モデルによる理論株価はいくらですか。,50円,75円,83円,91円,【５】-,3,83円,まず2014年度末時点の理論株価（その時点の現在価値）を求める。#X社は配当の成長率gが5％と一定の成長率となり、当初の配当DIV1が5円、株主資本コストが10％ であるので、5/(0.1-0.05)=100円#2013年、2014年は無配であるため、2年分の株主資本コストで割引けば2012年度末時点の理論株価が算出できる。#よって、100/(1+0.1)2=82.64≒83円,
SECT001,Q0250,ゼロ成長配当割引モデル,ゼロ成長配当割引モデルについて、現在の理論価格が500円であるとき、1年後の理論株価の期待値はいくらですか。 ただし、リスクフリー・レートは2.0％、株式の均衡期待収益率は5.0％とする。,476円,490円,500円,510円,【５】-,3,500円,０成長率配当割引モデルでは常に配当額が一定であるため、理論株価は変わらない。#実際に計算してみても、配当額＝500×0.05=25円#理論株価＝25/0.05=500円,
SECT001,Q0260,企業価値EBITDA比率,Z社の今期の売上高は2000億円、減価償却費は100億円、営業利益は500億円、純利益は200億円、今期末の有利子負債総額は1200億円、株式時価総額 は2400億円とする。このとき、Z社の今期の企業価値EBITDA比率はいくらですか。,４倍,６倍,８倍,９倍,【５】-,3,８倍,企業価値・・・有利子負債総額＋株式時価総額#EBITDA(Earnings before Interests Tax Depreciation and Amortization）・・・営業利益＋減価償却費#企業価値EBITDA比率　＝　企業価値/EBITDA#企業価値＝1200億円＋2400億円＝3600億円#EBITDA＝500億円＋100億円＝600億円#よって、3600億円/600億円＝6,
SECT001,Q0270,企業価値EBITDA比率,株式の評価尺度に関する次の記述のうち、正しくないものはどれですか。,PBRは1株当たり自己資本というストックとの比較で株価を評価する尺度である。,負債のある企業を評価する場合、株価EBITDA比率は企業価値EBITDA比率よりも評価指標として適切である。,株価売上高比率はその企業の売上高利益率のノーマルな水準が業界平均や同業他社と同等の水準と考えて株価評価しているといえる。,益回りと債券利回りの差は、株式と債券の相対的な有利さを判断することに使われる。,【５】-,2,負債のある企業を評価する場合、株価EBITDA比率は企業価値EBITDA比率よりも評価指標として適切である。,負債のある企業の場合、負債を考慮した指標である企業価値EBITDA比率を用いる方が適切である。#PBR(Price Book-Value Ration:株価純資産倍率)・・・株価/1株あたり自己資本#企業価値EBITDA比率＝（有利子負債総額＋株式時価総額）/EBITDA#株価EBITDA比率＝株価/1株あたりEBITDA,
SECT001,Q0280,CAPM,配当はサステイナブル成長率で永続的に成長すると仮定する。株式の均衡期待収益率（株主の要求期待収益率）は、CAPMに 従って形成されると仮定する。リスクフリー・レートは２％、マーケット・リスクプレミアムは５％である。理論株価の算出には配当割引モデル を用いた時、均衡期待収益率10％の有利子負債のない会社の配当直後の株式ベータはいくらか。,1,1.4,1.6,2,【５】-,3,1.6,CAPM(Capital Asset Pricing Model：資本資産評価モデル):多くの株式からなるマーケットをベンチマークとして，個別株式のリスク・リターン関係を表す。 マーケット全体のリスクに対するプレミアムをマーケット・リスクプレミアム（エクイティ・リスクプレミアム）という。 この計算式によると、10％＝２％＋ベータ×５％よって、ベータ＝８％/５％、これをといて、 ベータ＝１．６となる。,
SECT001,Q0290,CAPM,理論株価の算出には配当割引モデル を用いた場合、自己資本簿価1億円、ROE10%、サステナブル成長率ゼロ、均衡期待収益率10％である企業の理論株価として正しいものはどれか。ただしこの企業は配当落ち直後で有利子負債ゼロ、発行済株式数は1億株である。また配当はサステイナブル成長率で今後永続的に成長し、株式の均衡期待収益率（株主の要求期待収益率）はCAPMに 従って形成される。リスクフリー・レートは２％、マーケット・リスクプレミアムは５％である。,100円,500円,800円,1000円,【５】-,4,1000円,この企業のサステイナブル成長率は０なのでゼロ成長率モデルを適用して理論株価を算出する。よって、配当額がわかればよい。#ROE(Return on Equity)・・・株主資本利益率＝当期純利益/株主資本#ROEが10％で自己資本が1000億円なので、当期純利益は100億円であることがわかる。#ゼロ成長率モデルでは当期純利益は全て配当となるので、配当金は100億円となり、1株あたりの 配当金額は100円となる。#ゼロ成長率モデルの理論株価算出式を用いると100/0.1=1000円となる。,
SECT001,Q0300,株式の理論株価,自己資本簿価1000億円、ROE10%、サステイナブル成長率４％、均衡期待収益率が8％のとき、この企業の株式の理論株価はいくらですか。ただし、現在は配当落ち直後のデータであり、有利子負債はなく、発行済株式数は1億株とする。 配当はサステイナブル成長率で永続的に成長すると仮定する。株式の均衡期待収益率（株主の要求期待収益率）は、CAPMに 従って形成される。リスクフリー・レートは２％、マーケット・リスクプレミアムは５％である。理論株価の算出には配当割引モデル を用いて良い。,1000円,1500円,2000円,2500円,【５】-,2,1500円,サステイナブル成長率の算出式を用いて配当額を求める。#今期の当期純利益はROEが１０％、自己資本が1000億円なので、1000億円×１０％＝100億円となる。#サステイナブル成長率が４％、ROEが１０％であるから、配当性向は４％＝１０％×（１－配当性向）より、 配当性向＝１－０．４＝０．６＝６０％となり、配当額は６０億円と求まる。#よって、理論株価は60/(0.08-0.04)=1500となる。#サステナブル成長率モデルとは、毎期の配当が一定率で成長するモデルで、理論株価=1株配当/(株主資本コスト-サステナブル成長率)で表現される。,
SECT001,Q0310,PBR,自己資本簿価1000億円、ROE10%、サステナブル成長率4%、均衡期待収益率が12％のとき、この企業のPBRについて正しいものはどれですか。ただし、今は配当落ち直後であり、有利子負債はなく、発行済株式数は1億株であり、配当はサステイナブル成長率で永続的に成長すると仮定し、株式の均衡期待収益率はCAPMに従って形成される。リスクフリー・レートは２％、マーケット・リスクプレミアムは５％である。理論株価の算出には配当割引モデル を用いて良い。,1倍を下回る。,1倍に等しい。,1倍を上回る。,一概に言えない,【５】-,1,1倍を下回る。,サステイナブル成長率の算出式を用いる。今回のY社の配当額を求める。#今期の当期純利益はROEが１０％、自己資本が1000億円なので、1000億円×１０％＝100億円となる。#サステイナブル成長率が４％、ROEが１０％であるから、配当性向は４％＝１０％×（１－配当性向）より、 配当性向＝１－０．４＝０．６＝６０％となり、配当額は６０億円と求まる。#よって、理論株価は60/(0.12-0.04)=750となる。#PBR(Price Book-Value Ratio：株価純資産倍率）＝株価/自己資本で750/1000=0.75となり1倍を下回る。,
SECT001,Q0320,配当政策と理論株価,ROEが均衡(株主)期待収益率に等しい企業において、配当政策と理論株価について正しいものはどれですか。,配当性向を高めると株価は上昇する。,配当性向を高めると株価は下落する。,配当性向を高めても株価は変化しない。,配当性向と株価の関係は一概にはいえない。,【５】-,3,配当性向を高めても株価は変化しない。,理論株価＝配当額/(期待収益率－サステイナブル成長率）＝配当性向×当期純利益/(期待収益率　－　ROE×（１－配当性向））であるが、本題では期待収益率とROEが同一の値であるから、式にあてはめると、理論株価＝配当性向×当期純利益/ROE×配当性向＝当期純利益/ROEとなり、配当性向が株価に影響しないことがわかる,
SECT001,Q0330,ROEと配当性向,A社の投資家の要求収益率は１５％で一定、サステイナブル成長率を１０％とし、ROE、配当性向はそれぞれ一定とする。当期EPS55円、当期DPS（一株配当)33円、当期期首BPS220円であるA社は負債を持たず配当支払い以外の資本取引を行わず配当は期末に支払われる。A社のROEと配当性向はそれぞれいくらですか。,ROEは２０％、配当性向は２０％,ROEは２０％、配当性向は５０％,ROEは２５％、配当性向は５０％,ROEは２５％、配当性向は６０％,【５】-,4,ROEは２５％、配当性向は６０％,ROE(Retrun on Equity:株主資本利益率)＝当期純利益/自己資本なので、55/220=25％となる。配当性向は配当額/当期純利益なので、33/55=0.6=60％となる。,
SECT001,Q0340,EPSとDPS,A社の投資家の要求収益率は１５％で一定、サステイナブル成長率を１０％とし、ROE、配当性向はそれぞれ一定とする。前期EPS55円、前期DPS（一株配当)33円であるA社は負債を持たず配当支払い以外の資本取引を行わず配当は期末に支払われる。A社の当期1株当たり利益(EPS)と1株当たり配当(DPS)はそれぞれいくらですか。,EPSは55.0円、DPSは33.3円,EPSは60.0円、DPSは33.3円,EPSは60.0円、DPSは36.3円,EPSは60.5円、DPSは36.3円,【５】-,4,EPSは60.5円、DPSは36.3円,サステイナブル成長で配当性向が一定なので、利益もサステイナブル成長率で成長する。よって、1.1×55=60.5#DPSも同様に33×1.1＝36.3,
SECT001,Q0350,残余利益モデル,残余利益モデルに関する次の記述のうち、正しくないものはどれですか。,残余利益とは、純利益から期首自己資本に要求期待収益率を掛けたものを差引いた結果である。,毎期の残余利益の割引現在価値合計が、株式の理論価値となる。,クリーンサープラス関係を前提とすれば、今期純利益と今期期首自己資本の和から今期期末自己資本を差引いたものが、今期配当に等しい。,クリーンサープラス関係を前提とすれば、残余利益モデルは配当利益モデルと整合的なことを示すことができる。,【５】-,2,毎期の残余利益の割引現在価値合計が、株式の理論価値となる。,毎期の残余利益の割引現在価値合計と期首の自己資本の和が株式の理論価値となるため、2が誤り。,
SECT001,Q0360,残余利益モデル,A社の投資家の要求収益率は15%で一定、サステイナブル成長率を10%とし、ROE、配当性向はそれぞれ一定とする。今期一株あたり残余利益22円、期首BPS220であるA社は負債を持たず配当支払い以外の資本取引を行わず配当は期末に支払われる。残余利益モデルにおける理論株価による第2期期首のA社株式の理論株価はいくらですか。,600.0円,660.0円,666.7円,781.2円,【５】-,2,660.0円,理論株価＝自己資本＋今期残余利益/(要求収益率－サステイナブル成長率)#であるから、220+22/(0.15-0.1)=55+22×0.05=660円,
SECT001,Q0370,残余利益とBPS,期待収益率15%で一定、当期EPS60円、当期BPS242円、前期期首BPSが220円、前期残余利益が22円の時、当期のBPS(期首)と1株当たり残余利益はそれぞれいくらですか。,BPSは231円、1株当たり残余利益は20.0円。,BPSは242円、1株当たり残余利益は22.0円。,BPSは242円、1株当たり残余利益は23.7円。,BPSは288円、1株当たり残余利益は24.2円。,【５】-,3,BPSは242円、1株当たり残余利益は23.7円。,前期BPSと前期残余利益から当期BPSは220+22=242円となる。#残余利益＝純利益 - BPS×要求収益率＝60　-　242×0.15＝60-36.3＝23.7円,
SECT001,Q0380,債券利回り,債券の利回りに関する次の記述のうち、正しくないものはどれですか。,直接利回りには、満期まで保有した場合のキャピタルゲインまたはロスが考慮されていない。,アンダーパー債券の最終利回りはキャピタルロスを考慮しているため、同債券の直接利回りより低い。,オーバーパー債券では、単利最終利回りは複利最終利回りより低い。,アンダーパー債券では、クーポンレートは複利最終利回りより低い。,【５】-,2,アンダーパー債券の最終利回りはキャピタルロスを考慮しているため、同債券の直接利回りより低い。,アンダーパー債券の最終利回りはキャピタルゲインとなり、直接利回りプラス、売却益があるので、直接利回りより高い。#アンダーパー債券・・・債券価格が額面より低い債券。#オーバーパー債券・・・債券価格が額面より高い債券。#最終利回り・・・債券の現在価格と将来キャッシュフローの割引現在価値を等しくする１つの割引率。#直接利回り・・・債券から得られる利益のうち利子だけを評価する利回り。#単利最終利回り・・・利子と償還損益を評価した利回り。償還損益を残存年で均等に割って利回りを算出する。#複利最終利回り・・・利子と償還損益を評価した利回り。各年の利子（クーポン）を次年度に再投資すると考える。,
SECT001,Q0390,債券価格,額面１００円、年１回利払い、クーポンレート１．２％、残存期間５年の債券の最終利回りが１．２％のとき、この債券の１年間の所有期間利回りが １．３％となる１年後の債券価格はいくらですか。なお、現在は利払い直後とする。,９９．２３円,１００．１０円,１０１．３５円,１０２．８５円,【５】-,2,１００．１０円,最終利回りがクーポンレートと同一なので、現在の債券価格は１００円ということがわかる。#よって、１年後の債券価格をPとすると、（P＋１．２）/１＋０．０１３＝１００となり、#１０１．３＝P＋１．２　よって、P＝１００．１となる。,
SECT001,Q0400,利回り曲線,利回り曲線に関する次の記述のうち、正しくないものはどれですか。,純イールドが多い理由の１つは、長期債投資の方が短期債投資よりリスクが高いので、高いリスクプレミアムを要求するためと考えられる。,逆イールドの背景には、金融引締め政策の実行により短期金利は急速に上昇するが、高金利は長期間続かないと市場が判断して、長期金利はそれほど 上がらないというものが考えられる。,中期の金利が長期や短期と比べて高いこぶ状のイールドカーブは、純イールドから逆イールドへ移行する際に見られ、市場の効率性に反する。,純期待仮説では、現在の長期金利に含まれているフォワードレートは将来の短期金利の期待値と等しいと説明するので、右上がりの利回り曲線には 将来の短期金利上昇の予想が含まれていると考える。,【５】-,3,中期の金利が長期や短期と比べて高いこぶ状のイールドカーブは、純イールドから逆イールドへ移行する際に見られ、市場の効率性に反する。,純イールド・・・右上がりの利回り曲線。純イールドとなる頻度が高い理由として短期投資より長期投資の方がリスクが高いためリスクプレミアムがかかるためと考えられる。 また、将来短期金利が上昇するという予想も含まれている。#逆イールド・・・右下がりの利回り曲線。金融当局が金融引き締め政策を実施した結果、短期金利は急速に上昇するが長期に続かないと考えられるため、長期金利はそれほど 上昇しない等の理由が考えられる。#純イールドと逆イールド間の移行中間・・・純イールドから逆イールド、または逆イールドから純イールドへの移行の中間において中期が最も低く、短期、長期が高い 形やその逆の中期が最も高いこぶ状の計上を示す形もある。#純粋期待仮説・・長期金利というのは、短期金利が将来どのようになるのかという予想のみを純粋に反映しているという仮説。#流動性プレミアム仮説・・・短期債と長期債では長期債の方が流動性が小さい。よって、その分長期債の方がリスクプレミアムが発生し、金利が高くなるという仮説。#市場分断仮説・・・短期資金市場の参加者と長期資金市場の参加者は異なるため、期間の異なる資金市場ではそれぞれの需給で金利が決まるという仮説。,
SECT001,Q0410,債券投資リスク,債券投資リスクに関する次の記述のうち、正しくないものはどれですか。,金利が上昇すると一般に債券価格が下落する。,格付の高い債券ほどデフォルトリスクが大きい。,取引があまり活発でない債券を大量に売却しようとすると、価格が下落するリスクがある。,コーラブル債は金利が低下するほど期限前に償還されるリスクが大きくなる。,【５】-,2,格付の高い債券ほどデフォルトリスクが大きい。,コーラブル債・・・任意償還のことをコールといい、任意償還条項のついた債券をコーラブル債という。発行者は金利が下がった場合には任意償還を行い、 より低い金利の債券に借換えができる。,
SECT001,Q0420,債券の信用格付け,債券の信用格付けに関する次の記述のうち、正しいものはどれですか。,一度付与された格付は、原則としてその債券が償還されるまでの間、見直しや変更が行われることはない。,資産担保証券（ABS)などの証券化商品は格付の対象にならない。,国や政府機関などが発行するソブリン債は、信用リスクがないため格付の対象にならない。,信用格付では財務上の特約など個々の債券の条件も考慮されるため、同一発行体の発行した債券でも異なる格付が付与されることもある。,【５】-,4,信用格付では財務上の特約など個々の債券の条件も考慮されるため、同一発行体の発行した債券でも異なる格付が付与されることもある。,４の通り、信用格付は発行体ではなく、発行された債券に対して格付するため、同一発行体の発行した債券でも異なる格付が付与されることもある。,
SECT001,Q0430,債券の信用格付け,信用格付けに関する次の記述のうち、正しくないものはどれですか。,格付会社は信用格付の正確性を示すために、過去の格付別のデフォルト率を公表している。,格付会社が公表する過去20年間の実績に基づく格付別平均累積デフォルト率をみると、投資適格等級と投機的等級のデフォルト率に大きな差があることがわかる。,格付会社が公表する過去20年間の実績に基づく各付別平均累積デフォルト率をみると、日本の発行体の平均累積デフォルト率は世界より高いことがわかる。,低格付債（BBBもしくはBaa以下）における格付間の金利スプレッド差は、高格付債（A以上）におけるそれより大きい。,【５】-,3,格付会社が公表する過去20年間の実績に基づく各付別平均累積デフォルト率をみると、日本の発行体の平均累積デフォルト率は世界より高いことがわかる。,日本の発行体の平均累積デフォルト率は世界平均より低い。,
SECT001,Q0440,デュレーションとコンベクシティ,デュレーションとコンベクシティに関する次の記述のうち、正しくないものはどれですか。,マコーレー・デュレーションはキャッシュフローの平均残存年数である。,修正デュレーションは、最終利回りの変化が微小な場合、債券価格の変化率がその何倍かを近似した尺度である。,修正デュレーションは、一般にマコーレー・デュレーションより大きな値となる。,一般的な固定利付債券では、最終利回りの上昇・下落にかかわらず、コンベクシティは債券価格の正の変化として影響する。,【５】-,3,修正デュレーションは、一般にマコーレー・デュレーションより大きな値となる。,修正デュレーションはマコーレー・デュレーションを（１＋最終利回り）で割ったものなので、一般的にマコーレー・デュレーションの 方が大きい値となる。 ,
SECT001,Q0450,株価指数先物のキャリー損益,いま、現物株価指数は10万円、先物の満期までのリスクフリー・レートは1.00％（年率)、配当利回りは1.50％（年率)、先物の満期までの日数は30日である。 この株価指数先物のキャリー損益（理論ベーシス)はいくらですか。ただし、いずれも１年＝365日ベースで年率換算されているものとする。,14円のキャリー損,10円のキャリー損,0円,4円のキャリー益,【５】-,2,10円のキャリー損,先物理論価格＝10万 ×（1+(0.01-0.015)×30/365) ＝9995.89 よって9996円#これより現物価格と先物価格の差は4円となり先物価格の方が安いので、キャリー益は４円となる。#キャリー損益・・・先物価格と現物価格の差#先物価格＝現物価格×（１＋金利－配当利回り）#※上記の金利と配当利回りは年率換算しない少数表示ベース、よって金利と配当利回りが年率の％で与えられた場合は下記の式となる#先物価格＝現物価格×（１＋(（金利－配当利回り）/100)×(先物満期までの日数/365)),
SECT001,Q0460,株式オプション価格,裁定取引機会が存在しないという前提のもとで、ヨーロピアン・タイプの株式プットオプション価格に関する次の記述のうち、 正しくないものはどれですか。ただし、対象株式に配当はないものとする。,行使価格が低いものほど安い。,本源的価値（本質的価値）を下回ることもある。,株価を上回ることもある。,行使価格を上回ることもある。,【５】-,4,行使価格を上回ることもある。,プットオプションは○○で売れる権利であるため、行使価格を上回ることはない。プットオプションが 最も儲かるのは該当株式が０円となった場合であるが、行使価格とプットオプションの値段が同一となった場合に は株価が０円となった時でさえ儲けがないため、プットオプションの値段が行使価格を上回ることはない。,
